<?xml version="1.0" encoding="UTF-8"?>
<acuario xmlns:xsi="http://www.w3.org/2001/XMLSchema-instance" xsi:noNamespaceSchemaLocation="file:///C:/Users/nicoc/Desktop/XML/esquemaPez.xsd">
<pez>
<nombre>Pingi</nombre>
<edad>1 año</edad>
<color>Rojo</color>
<color>Verde</color>
</pez>


<pez>
<nombre>faz</nombre>
<edad>3 año</edad>
<color>Azul</color>
</pez>

</acuario>



